{
  "schema_version": "1.0.0",
  "authorization_gate": "HUMAN_NY_OSC_FIRST_DOWNLOAD_TRANSIENT_LOCAL_FILE_RETENTION_AUTHORIZATION",
  "required_owner_authorization": "APPROVO NY OSC FIFTH TRANSIENT LOCAL FILE BOUNDED ONCE",
  "owner_authorization": "APPROVO NY OSC FIFTH TRANSIENT LOCAL FILE BOUNDED ONCE",
  "granted_on": "2026-09-20",
  "execution_approval_ref": "OWNER_APPROVAL_2026-09-20_NY_OSC_FIFTH_TRANSIENT_LOCAL_FILE_BOUNDED_ONCE_4A841291",
  "status": "CONSUMED_SINGLE_USE_NON_REUSABLE",
  "single_use": true,
  "reusable": false,
  "retry_authorized": false,
  "attempt_number": 5,
  "proposal_ref": "sources/proposals/ny_osc_owner_name_file_fifth_bounded_attempt_authorization.v1.json",
  "proposal_checkpoint": "8ce856ddbeac5d2300f808729a887803e212b240",
  "proposal_ci_run_id": 35460348569,
  "runner_checkpoint": "4a8412911b3b9ae59525dee3a0565951e2722528",
  "runner_ci_run_id": 35474594533,
  "runner_ci_conclusion": "SUCCESS",
  "scope": {
    "expected_local_filename": "FINDERS.zip",
    "max_download_bytes": 450000000,
    "dedicated_os_temp_directory_required": true,
    "immediate_logical_deletion_required": true,
    "durable_raw_persistence_allowed": false,
    "repository_persistence_allowed": false,
    "cloud_sync_allowed": false,
    "chat_upload_allowed": false,
    "physical_secure_erasure_guaranteed": false
  },
  "authorization_does_not_grant": {
    "source_network_access": false,
    "remote_preflight": false,
    "download": false,
    "source_activation": false,
    "production_classification_activation": false,
    "identity_resolution": false,
    "beneficiary_matching": false,
    "outreach": false,
    "fee_agreement": false,
    "representation": false,
    "claim_activity": false
  },
  "consumed_on": "2026-09-20",
  "execution_result_ref": "sources/evidence/ny_osc_owner_name_file_fifth_attempt_execution_result.v1.json"
}
